id;title;content;icon
training;Jugend-Treff & Training;Unter fachkundiger Anleitung unserer Partner Schach-Freunde Pelikan werden einfache Spielzuege und taktische Varianten erprobt. Dies im freien Spiel kreativ kombinierend - das ist Schach!<br><br>Unser Jugend-Treff bietet zudem freies Spiel, individuelle Betreuung sowie Basis-Ausbildung und Aufbau-Wissen fuer alle Stufen.;♟️
liga;Jugend-Ligen;Gemeinsam mit unseren Betreuern bespielen wir aktiv verschiedene Ligen in der Region:<br><ul><li><strong>In der Schweiz:</strong> SMM Mannschaften und SGM Gruppen</li><li><strong>Am D-Hochrhein:</strong> Ligen in den Stufen Bereich, Bezirk und Kreis</li></ul>;⚔️
schulen;Schul-Schach AGs;Wir engagieren uns stark an lokalen Schulen und fuehren derzeit Schach-AGs fuer folgende Bildungseinrichtungen durch:<br><ul><li>Freie Waldorfschule Schopfheim</li><li>Georg-Buechner-Gymnasium Rheinfelden</li><li>Christian-Heinrich-Zeller-Schule Karsau</li></ul>;🏫
turniere;Turniersport;Der Turniersport kommt bei uns nicht zu kurz: Den renommierten Aargauer Jugend-Grand-Prix besuchen wir regelmaessig mit unseren Partnern aus der Schweiz.;🏆
foerderung;Foerderung & Teilnahme;Unser Jugendschach wird durch Vereinsbeitraege und engagierte Sponsoren stark gefoerdert. Dies ermoeglicht ein breites Angebot, verpflichtet die Teilnehmer im Gegenzug aber auch zur regelmaessigen Teilnahme an unseren Trainings und Events.;🤝